{
  "schema_version": 3,
  "container_id": "0700982f1b8922c0a25ff2056218f5754c009fd5e87823aba1b0ba95c1cad79f",
  "profile_start": "2026-06-11T19:50:47.66809542Z",
  "profile_end": "2026-06-11T19:50:51.67449584Z",
  "coverage": {
    "process_start_observed": true,
    "attach_time": "2026-06-11T19:50:47.668094628Z",
    "first_exec_time": "2026-06-11T19:50:47.670426678Z"
  },
  "container_starts": [
    {
      "container_id": "0700982f1b8922c0a25ff2056218f5754c009fd5e87823aba1b0ba95c1cad79f",
      "timestamp": "2026-06-11T19:50:47.66809542Z"
    }
  ],
  "event_loss": {
    "total": 0,
    "by_stage": {
      "bpf_reserve_failed": 0,
      "decode_failed": 0,
      "untracked_cgroup": 0
    },
    "tolerated": {
      "path_read_failed": 1
    },
    "not_instrumented": []
  },
  "files": {
    "/bin/sh": {
      "source": "direct",
      "access_modes": [
        "x",
        "m"
      ],
      "first_seen": "2026-06-11T19:50:47.670426678Z",
      "last_seen": "2026-06-11T19:50:47.670670467Z",
      "count": 1
    },
    "/etc/ld.so.cache": {
      "source": "direct",
      "access_modes": [
        "r"
      ],
      "first_seen": "2026-06-11T19:50:47.670778507Z",
      "last_seen": "2026-06-11T19:50:47.670778507Z",
      "count": 1
    },
    "/lib/aarch64-linux-gnu/libm.so.6": {
      "source": "direct",
      "access_modes": [
        "r",
        "m"
      ],
      "first_seen": "2026-06-11T19:50:47.670782673Z",
      "last_seen": "2026-06-11T19:50:47.670871297Z",
      "count": 1
    },
    "/lib/libc.so.6": {
      "source": "direct",
      "access_modes": [
        "r",
        "m"
      ],
      "first_seen": "2026-06-11T19:50:47.670888755Z",
      "last_seen": "2026-06-11T19:50:47.670893672Z",
      "count": 1
    },
    "/lib/libm.so.6": {
      "source": "direct",
      "access_modes": [
        "r",
        "m"
      ],
      "first_seen": "2026-06-11T19:50:47.670787798Z",
      "last_seen": "2026-06-11T19:50:47.670871297Z",
      "count": 1
    },
    "/lib/libresolv.so.2": {
      "source": "direct",
      "access_modes": [
        "r",
        "m"
      ],
      "first_seen": "2026-06-11T19:50:47.670874672Z",
      "last_seen": "2026-06-11T19:50:47.670886005Z",
      "count": 1
    },
    "/usr/lib/aarch64-linux-gnu/libm.so.6": {
      "source": "direct",
      "access_modes": [
        "r",
        "m"
      ],
      "first_seen": "2026-06-11T19:50:47.670785423Z",
      "last_seen": "2026-06-11T19:50:47.670871297Z",
      "count": 1
    }
  }
}
